{
  "$schema": "../../../schemas/academic/registry-v1.schema.json",
  "schema_version": "1.0",
  "course_id": "laboratorio-biomecanica",
  "coverage_status": "planned",
  "items": [
    {
      "id": "LABBIO-U01-MED01",
      "type": "figure",
      "status": "planned",
      "unit_id": "LABBIO-U01",
      "linked_learning_outcome_ids": [
        "LABBIO-U01-LO01",
        "LABBIO-U01-LO02"
      ],
      "pedagogical_purpose": "Diagrama de calibración y marcos",
      "alt_text_draft": "Esquema sintético de volumen de calibración, ejes y controles de calidad sin personas.",
      "license_requirements": "Usar material propio o con licencia compatible y registrar atribución y procedencia.",
      "source_ids": []
    },
    {
      "id": "LABBIO-U02-MED01",
      "type": "figure",
      "status": "planned",
      "unit_id": "LABBIO-U02",
      "linked_learning_outcome_ids": [
        "LABBIO-U02-LO01",
        "LABBIO-U02-LO02"
      ],
      "pedagogical_purpose": "Pipeline cinemático",
      "alt_text_draft": "Trayectoria sintética que muestra muestreo, filtrado, derivación, eventos y comparación de sensibilidad.",
      "license_requirements": "Usar material propio o con licencia compatible y registrar atribución y procedencia.",
      "source_ids": []
    },
    {
      "id": "LABBIO-U03-MED01",
      "type": "figure",
      "status": "planned",
      "unit_id": "LABBIO-U03",
      "linked_learning_outcome_ids": [
        "LABBIO-U03-LO01",
        "LABBIO-U03-LO02"
      ],
      "pedagogical_purpose": "GRF, CoP y momentos",
      "alt_text_draft": "Diagrama de plataforma de fuerza con ejes, signos, GRF, CoP y momentos sobre un contacto sintético.",
      "license_requirements": "Usar material propio o con licencia compatible y registrar atribución y procedencia.",
      "source_ids": []
    },
    {
      "id": "LABBIO-U04-MED01",
      "type": "figure",
      "status": "planned",
      "unit_id": "LABBIO-U04",
      "linked_learning_outcome_ids": [
        "LABBIO-U04-LO01",
        "LABBIO-U04-LO02"
      ],
      "pedagogical_purpose": "Pipeline sEMG",
      "alt_text_draft": "Señal sEMG sintética desde adquisición hasta filtrado, rectificación, envolvente y normalización.",
      "license_requirements": "Usar material propio o con licencia compatible y registrar atribución y procedencia.",
      "source_ids": []
    },
    {
      "id": "LABBIO-U05-MED01",
      "type": "figure",
      "status": "planned",
      "unit_id": "LABBIO-U05",
      "linked_learning_outcome_ids": [
        "LABBIO-U05-LO01",
        "LABBIO-U05-LO02"
      ],
      "pedagogical_purpose": "Flujo de dinámica inversa",
      "alt_text_draft": "Entradas cinemáticas, cargas externas y parámetros inerciales que conducen a fuerzas y momentos articulares netos.",
      "license_requirements": "Usar material propio o con licencia compatible y registrar atribución y procedencia.",
      "source_ids": []
    },
    {
      "id": "LABBIO-U06-MED01",
      "type": "figure",
      "status": "planned",
      "unit_id": "LABBIO-U06",
      "linked_learning_outcome_ids": [
        "LABBIO-U06-LO01",
        "LABBIO-U06-LO02"
      ],
      "pedagogical_purpose": "Paquete reproducible",
      "alt_text_draft": "Mapa de estimando, datos, código, incertidumbre, figura, metadatos, versión y checksum de un expediente sintético.",
      "license_requirements": "Usar material propio o con licencia compatible y registrar atribución y procedencia.",
      "source_ids": []
    }
  ]
}
