{
  "$schema": "../../../schemas/academic/registry-v1.schema.json",
  "schema_version": "1.0",
  "course_id": "biomateriales",
  "status": "complete",
  "items": [
    {
      "id": "BIOMAT-U01-M01",
      "unit_id": "BIOMAT-U01",
      "type": "figure",
      "title": "Selección de materiales según el contexto",
      "purpose": "Hacer visibles relaciones, entradas, controles, incertidumbre y límites sin sustituir la explicación textual.",
      "status": "complete",
      "accessibility_requirement": "Debe incluir equivalente textual, etiquetas legibles, navegación por teclado cuando sea interactivo y no depender exclusivamente de color.",
      "topic_id": "BIOMAT-U01-T01",
      "asset_path": "assets/figures/biomateriales/unit-01.svg",
      "width": 1200,
      "height": 800,
      "alt_text": "Uso previsto y familias de candidatos alimentan requisitos y comparación trazable. Las cuatro familias son metales, cerámicas, polímeros y compuestos; no se asigna una superioridad universal. La preselección es provisional.",
      "caption": "Uso previsto y familias de candidatos alimentan requisitos y comparación trazable. Las cuatro familias son metales, cerámicas, polímeros y compuestos; no se asigna una superioridad universal. La preselección es provisional.",
      "attribution": "Elaboración propia de CitoNauta; esquemas y ejemplos hipotéticos, sin datos experimentales",
      "license": "CC BY-NC 4.0",
      "source_ids": [
        "basics-of-biocompatibility-information-needed-for-assessment-by-the-fda"
      ],
      "pedagogical_purpose": "Selección de materiales según el contexto"
    },
    {
      "id": "BIOMAT-U02-M01",
      "unit_id": "BIOMAT-U02",
      "type": "figure",
      "title": "Normalizar fuerza y alargamiento",
      "purpose": "Hacer visibles relaciones, entradas, controles, incertidumbre y límites sin sustituir la explicación textual.",
      "status": "complete",
      "accessibility_requirement": "Debe incluir equivalente textual, etiquetas legibles, navegación por teclado cuando sea interactivo y no depender exclusivamente de color.",
      "topic_id": "BIOMAT-U02-T02",
      "asset_path": "assets/figures/biomateriales/unit-02.svg",
      "width": 1200,
      "height": 800,
      "alt_text": "Dos probetas ideales con E = 1000 MPa, longitud inicial 20 mm y áreas 2 y 4 mm² requieren 20 y 40 N para alargarse 0,2 mm. Ambas tienen deformación 1 % y tensión nominal 10 MPa. Datos hipotéticos, sin plasticidad ni rotura.",
      "caption": "Dos probetas ideales con E = 1000 MPa, longitud inicial 20 mm y áreas 2 y 4 mm² requieren 20 y 40 N para alargarse 0,2 mm. Ambas tienen deformación 1 % y tensión nominal 10 MPa. Datos hipotéticos, sin plasticidad ni rotura.",
      "attribution": "Elaboración propia de CitoNauta; esquemas y ejemplos hipotéticos, sin datos experimentales",
      "license": "CC BY-NC 4.0",
      "source_ids": [
        "astm-e8-e8m-25-standard-test-methods-for-tension-testing-of-metallic-materials"
      ],
      "pedagogical_purpose": "Normalizar fuerza y alargamiento"
    },
    {
      "id": "BIOMAT-U03-M01",
      "unit_id": "BIOMAT-U03",
      "type": "figure",
      "title": "Interfaz acondicionada por proteínas",
      "purpose": "Hacer visibles relaciones, entradas, controles, incertidumbre y límites sin sustituir la explicación textual.",
      "status": "complete",
      "accessibility_requirement": "Debe incluir equivalente textual, etiquetas legibles, navegación por teclado cuando sea interactivo y no depender exclusivamente de color.",
      "topic_id": "BIOMAT-U03-T01",
      "asset_path": "assets/figures/biomateriales/unit-03.svg",
      "width": 1200,
      "height": 800,
      "alt_text": "Una célula se representa sobre una capa de proteínas adsorbidas al material. Receptores de adhesión conectan con esa capa. Esquema sin escala; omite la complejidad molecular y no prueba seguridad biológica.",
      "caption": "Una célula se representa sobre una capa de proteínas adsorbidas al material. Receptores de adhesión conectan con esa capa. Esquema sin escala; omite la complejidad molecular y no prueba seguridad biológica.",
      "attribution": "Elaboración propia de CitoNauta; esquemas y ejemplos hipotéticos, sin datos experimentales",
      "license": "CC BY-NC 4.0",
      "source_ids": [
        "mediation-of-biomaterial-cell-interactions-by-adsorbed-proteins-a-review"
      ],
      "pedagogical_purpose": "Interfaz acondicionada por proteínas"
    },
    {
      "id": "BIOMAT-U04-M01",
      "unit_id": "BIOMAT-U04",
      "type": "figure",
      "title": "Masa molar y masa de la muestra",
      "purpose": "Hacer visibles relaciones, entradas, controles, incertidumbre y límites sin sustituir la explicación textual.",
      "status": "complete",
      "accessibility_requirement": "Debe incluir equivalente textual, etiquetas legibles, navegación por teclado cuando sea interactivo y no depender exclusivamente de color.",
      "topic_id": "BIOMAT-U04-T03",
      "asset_path": "assets/figures/biomateriales/unit-04.svg",
      "width": 1200,
      "height": 800,
      "alt_text": "Curvas hipotéticas: la masa molar media normalizada disminuye desde el inicio, mientras que la masa retenida permanece inicialmente constante y después cae. Tiempo arbitrario; las curvas no predicen un polímero real ni una tasa clínica.",
      "caption": "Curvas hipotéticas: la masa molar media normalizada disminuye desde el inicio, mientras que la masa retenida permanece inicialmente constante y después cae. Tiempo arbitrario; las curvas no predicen un polímero real ni una tasa clínica.",
      "attribution": "Elaboración propia de CitoNauta; esquemas y ejemplos hipotéticos, sin datos experimentales",
      "license": "CC BY-NC 4.0",
      "source_ids": [
        "astm-f1635-24-in-vitro-degradation-testing-of-hydrolytically-degradable-polymer-resins-and-fabricated-forms-fo"
      ],
      "pedagogical_purpose": "Masa molar y masa de la muestra"
    },
    {
      "id": "BIOMAT-U05-M01",
      "unit_id": "BIOMAT-U05",
      "type": "figure",
      "title": "Preguntas y técnicas de caracterización",
      "purpose": "Hacer visibles relaciones, entradas, controles, incertidumbre y límites sin sustituir la explicación textual.",
      "status": "complete",
      "accessibility_requirement": "Debe incluir equivalente textual, etiquetas legibles, navegación por teclado cuando sea interactivo y no depender exclusivamente de color.",
      "topic_id": "BIOMAT-U05-T01",
      "asset_path": "assets/figures/biomateriales/unit-05.svg",
      "width": 1200,
      "height": 800,
      "alt_text": "Cuatro paneles vinculan mecánica con tracción, topografía con rugosidad, mojabilidad con ángulo de contacto y química superficial con XPS. Cada medición exige condiciones y alcance propios; ninguna demuestra por sí sola seguridad.",
      "caption": "Cuatro paneles vinculan mecánica con tracción, topografía con rugosidad, mojabilidad con ángulo de contacto y química superficial con XPS. Cada medición exige condiciones y alcance propios; ninguna demuestra por sí sola seguridad.",
      "attribution": "Elaboración propia de CitoNauta; esquemas y ejemplos hipotéticos, sin datos experimentales",
      "license": "CC BY-NC 4.0",
      "source_ids": [
        "iso-ts-10993-19-2020-physico-chemical-morphological-and-topographical-characterization-of-materials",
        "astm-d7334-08-2022-surface-wettability-by-advancing-contact-angle-measurement",
        "iso-15472-2010-x-ray-photoelectron-spectrometers-calibration-of-energy-scales",
        "jcgm-100-2008-guide-to-the-expression-of-uncertainty-in-measurement",
        "astm-e8-e8m-24-tension-testing-of-metallic-materials"
      ],
      "pedagogical_purpose": "Preguntas y técnicas de caracterización"
    },
    {
      "id": "BIOMAT-U06-M01",
      "unit_id": "BIOMAT-U06",
      "type": "figure",
      "title": "Evaluación de la configuración final",
      "purpose": "Hacer visibles relaciones, entradas, controles, incertidumbre y límites sin sustituir la explicación textual.",
      "status": "complete",
      "accessibility_requirement": "Debe incluir equivalente textual, etiquetas legibles, navegación por teclado cuando sea interactivo y no depender exclusivamente de color.",
      "topic_id": "BIOMAT-U06-T03",
      "asset_path": "assets/figures/biomateriales/unit-06.svg",
      "width": 1200,
      "height": 800,
      "alt_text": "Material, fabricación y esterilización cuando corresponde alimentan la configuración final, que se evalúa según contacto, duración y exposición. Los datos de materia prima no cubren automáticamente los cambios del procesamiento.",
      "caption": "Material, fabricación y esterilización cuando corresponde alimentan la configuración final, que se evalúa según contacto, duración y exposición. Los datos de materia prima no cubren automáticamente los cambios del procesamiento.",
      "attribution": "Elaboración propia de CitoNauta; esquemas y ejemplos hipotéticos, sin datos experimentales",
      "license": "CC BY-NC 4.0",
      "source_ids": [
        "basics-of-biocompatibility-information-needed-for-assessment-by-the-fda"
      ],
      "pedagogical_purpose": "Evaluación de la configuración final"
    }
  ],
  "coverage_status": "complete"
}
