{
  "$schema": "../../../schemas/academic/registry-v1.schema.json",
  "schema_version": "1.0",
  "course_id": "desarrollo-dispositivos-medicos",
  "coverage_status": "complete",
  "items": [
    {
      "id": "DDM-U01-MED01",
      "type": "figure",
      "status": "complete",
      "unit_id": "DDM-U01",
      "linked_learning_outcome_ids": [
        "DDM-U01-LO01",
        "DDM-U01-LO02"
      ],
      "pedagogical_purpose": "De la observación a la necesidad",
      "license_requirements": "Usar material propio o con licencia compatible y registrar atribución y procedencia.",
      "source_ids": [
        "biodesign-innovation-process",
        "stanford-choosing-a-need"
      ],
      "topic_id": "DDM-U01-T01",
      "title": "De la observación a la necesidad",
      "asset_path": "assets/figures/desarrollo-dispositivos-medicos/unit-01.svg",
      "width": 900,
      "height": 900,
      "alt_text": "Observación, interpretación, actores y entorno informan una necesidad. La necesidad describe población, problema y resultado; todavía no selecciona tecnología. La disposición es una síntesis docente, no una secuencia obligatoria.",
      "caption": "Observación, interpretación, actores y entorno informan una necesidad. La necesidad describe población, problema y resultado; todavía no selecciona tecnología. La disposición es una síntesis docente, no una secuencia obligatoria.",
      "attribution": "Elaboración propia de CitoNauta; síntesis educativa basada en la unidad",
      "license": "CC BY-NC 4.0"
    },
    {
      "id": "DDM-U02-MED01",
      "type": "figure",
      "status": "complete",
      "unit_id": "DDM-U02",
      "linked_learning_outcome_ids": [
        "DDM-U02-LO01",
        "DDM-U02-LO02"
      ],
      "pedagogical_purpose": "Trazabilidad en dos direcciones",
      "license_requirements": "Usar material propio o con licencia compatible y registrar atribución y procedencia.",
      "source_ids": [
        "nasa-systems-engineering-handbook-requirements-management",
        "nasa-product-verification"
      ],
      "topic_id": "DDM-U02-T01",
      "title": "Trazabilidad en dos direcciones",
      "asset_path": "assets/figures/desarrollo-dispositivos-medicos/unit-02.svg",
      "width": 900,
      "height": 900,
      "alt_text": "La necesidad se vincula con validación; el requisito, con verificación. Arquitectura y control de cambios mantienen estos enlaces. Las flechas dobles representan trazabilidad, no causalidad ni una secuencia temporal.",
      "caption": "La necesidad se vincula con validación; el requisito, con verificación. Arquitectura y control de cambios mantienen estos enlaces. Las flechas dobles representan trazabilidad, no causalidad ni una secuencia temporal.",
      "attribution": "Elaboración propia de CitoNauta; síntesis educativa basada en la unidad",
      "license": "CC BY-NC 4.0"
    },
    {
      "id": "DDM-U03-MED01",
      "type": "figure",
      "status": "complete",
      "unit_id": "DDM-U03",
      "linked_learning_outcome_ids": [
        "DDM-U03-LO01",
        "DDM-U03-LO02"
      ],
      "pedagogical_purpose": "Del peligro al riesgo residual",
      "license_requirements": "Usar material propio o con licencia compatible y registrar atribución y procedencia.",
      "source_ids": [
        "essential-principles-of-safety-and-performance-of-medical-devices-and-ivd-medical-devices-edition-2"
      ],
      "topic_id": "DDM-U03-T01",
      "title": "Del peligro al riesgo residual",
      "asset_path": "assets/figures/desarrollo-dispositivos-medicos/unit-03.svg",
      "width": 900,
      "height": 900,
      "alt_text": "Identificar peligros y exposición, considerar probabilidad y severidad, priorizar seguridad inherente, protección e información de seguridad. Verificar controles y evaluar riesgo residual individual y global. No se propone un umbral universal de aceptación.",
      "caption": "Identificar peligros y exposición, considerar probabilidad y severidad, priorizar seguridad inherente, protección e información de seguridad. Verificar controles y evaluar riesgo residual individual y global. No se propone un umbral universal de aceptación.",
      "attribution": "Elaboración propia de CitoNauta; síntesis educativa basada en la unidad",
      "license": "CC BY-NC 4.0"
    },
    {
      "id": "DDM-U04-MED01",
      "type": "figure",
      "status": "complete",
      "unit_id": "DDM-U04",
      "linked_learning_outcome_ids": [
        "DDM-U04-LO01",
        "DDM-U04-LO02"
      ],
      "pedagogical_purpose": "Construir evidencia de verificación",
      "license_requirements": "Usar material propio o con licencia compatible y registrar atribución y procedencia.",
      "source_ids": [
        "fda-bench-performance-testing",
        "nasa-product-verification"
      ],
      "topic_id": "DDM-U04-T01",
      "title": "Construir evidencia de verificación",
      "asset_path": "assets/figures/desarrollo-dispositivos-medicos/unit-04.svg",
      "width": 900,
      "height": 900,
      "alt_text": "El requisito, criterio, configuración y muestra se combinan con método, condiciones, instrumentos e incertidumbre para interpretar el resultado. Un cambio exige analizar la aplicabilidad de la evidencia previa.",
      "caption": "El requisito, criterio, configuración y muestra se combinan con método, condiciones, instrumentos e incertidumbre para interpretar el resultado. Un cambio exige analizar la aplicabilidad de la evidencia previa.",
      "attribution": "Elaboración propia de CitoNauta; síntesis educativa basada en la unidad",
      "license": "CC BY-NC 4.0"
    },
    {
      "id": "DDM-U05-MED01",
      "type": "figure",
      "status": "complete",
      "unit_id": "DDM-U05",
      "linked_learning_outcome_ids": [
        "DDM-U05-LO01",
        "DDM-U05-LO02"
      ],
      "pedagogical_purpose": "Verificar y validar",
      "license_requirements": "Usar material propio o con licencia compatible y registrar atribución y procedencia.",
      "source_ids": [
        "nasa-product-verification",
        "applying-human-factors-and-usability-engineering-to-medical-devices"
      ],
      "topic_id": "DDM-U05-T01",
      "title": "Verificar y validar",
      "asset_path": "assets/figures/desarrollo-dispositivos-medicos/unit-05.svg",
      "width": 900,
      "height": 900,
      "alt_text": "Verificación compara desempeño con especificaciones; validación considera necesidades y uso previsto. Un ensayo de banco, un estudio de factores humanos y un estudio clínico responden preguntas distintas; el banco por sí solo no demuestra beneficio clínico.",
      "caption": "Verificación compara desempeño con especificaciones; validación considera necesidades y uso previsto. Un ensayo de banco, un estudio de factores humanos y un estudio clínico responden preguntas distintas; el banco por sí solo no demuestra beneficio clínico.",
      "attribution": "Elaboración propia de CitoNauta; síntesis educativa basada en la unidad",
      "license": "CC BY-NC 4.0"
    },
    {
      "id": "DDM-U06-MED01",
      "type": "figure",
      "status": "complete",
      "unit_id": "DDM-U06",
      "linked_learning_outcome_ids": [
        "DDM-U06-LO01",
        "DDM-U06-LO02"
      ],
      "pedagogical_purpose": "Un ciclo de vida con retroalimentación",
      "license_requirements": "Usar material propio o con licencia compatible y registrar atribución y procedencia.",
      "source_ids": [
        "fda-qmsr-design-development-transcript",
        "essential-principles-of-safety-and-performance-of-medical-devices-and-ivd-medical-devices-edition-2"
      ],
      "topic_id": "DDM-U06-T01",
      "title": "Un ciclo de vida con retroalimentación",
      "asset_path": "assets/figures/desarrollo-dispositivos-medicos/unit-06.svg",
      "width": 900,
      "height": 900,
      "alt_text": "Diseño y transferencia llevan a producción controlada; la información posmercado alimenta evaluación y cambios, que retroalimentan diseño y riesgos. Las obligaciones dependen de jurisdicción, uso previsto y sistema de calidad; el esquema no es una vía de autorización.",
      "caption": "Diseño y transferencia llevan a producción controlada; la información posmercado alimenta evaluación y cambios, que retroalimentan diseño y riesgos. Las obligaciones dependen de jurisdicción, uso previsto y sistema de calidad; el esquema no es una vía de autorización.",
      "attribution": "Elaboración propia de CitoNauta; síntesis educativa basada en la unidad",
      "license": "CC BY-NC 4.0"
    }
  ]
}
