{
  "$schema": "../../../schemas/academic/registry-v1.schema.json",
  "schema_version": "1.0",
  "course_id": "laboratorio-bioinstrumentacion",
  "coverage_status": "planned",
  "items": [
    {
      "id": "LABBIO-U01-MED01",
      "type": "figure",
      "status": "planned",
      "unit_id": "LABBIO-U01",
      "linked_learning_outcome_ids": [
        "LABBIO-U01-LO01",
        "LABBIO-U01-LO02"
      ],
      "pedagogical_purpose": "Diagrama o figura propia que haga visible el flujo entrada → transformación → medición → verificación de la unidad, con ejes, unidades, puntos de control y límites de seguridad cuando correspondan.",
      "alt_text_draft": null,
      "license_requirements": "Usar material propio o con licencia compatible y registrar atribución y procedencia.",
      "source_ids": []
    },
    {
      "id": "LABBIO-U02-MED01",
      "type": "figure",
      "status": "planned",
      "unit_id": "LABBIO-U02",
      "linked_learning_outcome_ids": [
        "LABBIO-U02-LO01",
        "LABBIO-U02-LO02"
      ],
      "pedagogical_purpose": "Diagrama o figura propia que haga visible el flujo entrada → transformación → medición → verificación de la unidad, con ejes, unidades, puntos de control y límites de seguridad cuando correspondan.",
      "alt_text_draft": null,
      "license_requirements": "Usar material propio o con licencia compatible y registrar atribución y procedencia.",
      "source_ids": []
    },
    {
      "id": "LABBIO-U03-MED01",
      "type": "figure",
      "status": "planned",
      "unit_id": "LABBIO-U03",
      "linked_learning_outcome_ids": [
        "LABBIO-U03-LO01",
        "LABBIO-U03-LO02"
      ],
      "pedagogical_purpose": "Diagrama o figura propia que haga visible el flujo entrada → transformación → medición → verificación de la unidad, con ejes, unidades, puntos de control y límites de seguridad cuando correspondan.",
      "alt_text_draft": null,
      "license_requirements": "Usar material propio o con licencia compatible y registrar atribución y procedencia.",
      "source_ids": []
    },
    {
      "id": "LABBIO-U04-MED01",
      "type": "figure",
      "status": "planned",
      "unit_id": "LABBIO-U04",
      "linked_learning_outcome_ids": [
        "LABBIO-U04-LO01",
        "LABBIO-U04-LO02"
      ],
      "pedagogical_purpose": "Diagrama o figura propia que haga visible el flujo entrada → transformación → medición → verificación de la unidad, con ejes, unidades, puntos de control y límites de seguridad cuando correspondan.",
      "alt_text_draft": null,
      "license_requirements": "Usar material propio o con licencia compatible y registrar atribución y procedencia.",
      "source_ids": []
    },
    {
      "id": "LABBIO-U05-MED01",
      "type": "figure",
      "status": "planned",
      "unit_id": "LABBIO-U05",
      "linked_learning_outcome_ids": [
        "LABBIO-U05-LO01",
        "LABBIO-U05-LO02"
      ],
      "pedagogical_purpose": "Diagrama o figura propia que haga visible el flujo entrada → transformación → medición → verificación de la unidad, con ejes, unidades, puntos de control y límites de seguridad cuando correspondan.",
      "alt_text_draft": null,
      "license_requirements": "Usar material propio o con licencia compatible y registrar atribución y procedencia.",
      "source_ids": []
    },
    {
      "id": "LABBIO-U06-MED01",
      "type": "figure",
      "status": "planned",
      "unit_id": "LABBIO-U06",
      "linked_learning_outcome_ids": [
        "LABBIO-U06-LO01",
        "LABBIO-U06-LO02"
      ],
      "pedagogical_purpose": "Diagrama o figura propia que haga visible el flujo entrada → transformación → medición → verificación de la unidad, con ejes, unidades, puntos de control y límites de seguridad cuando correspondan.",
      "alt_text_draft": null,
      "license_requirements": "Usar material propio o con licencia compatible y registrar atribución y procedencia.",
      "source_ids": []
    }
  ]
}
